title,category,reference,summary
Binary-Search-Tree-Visualizer,Python,https://github.com/SamarpanCoder2002/Binary-Search-Tree-Visualizer,"The Binary Search Tree Visualizer is a Python Tkinter-based tool that helps visualize various operations on a Binary Search Tree (BST). It includes functionalities for insertion, deletion, and multiple traversal methods (pre-order, post-order, in-order, level-order). Additionally, the visualizer demonstrates level-order traversal using a circular queue for enhanced understanding."
Ludo Game,Python,https://github.com/mansiag/Ludo,"Ludo is a strategy board game where 2 to 4 players race their tokens from start to finish by rolling dice, while avoiding being captured by opponents. Players must roll a 6 to enter a token into play and advance tokens based on dice rolls. The game ends when a player successfully moves all their tokens to the finish, with obstacles and opportunities for capturing opponents' tokens along the way."
Searching Algo Visualizer,Python,https://github.com/SamarpanCoder2002/Searching-Algo-Visualizer,The Searching Algorithm Visualizer is a Python Tkinter application that visually demonstrates linear and binary search algorithms. It uses the Pillow library for image handling and allows users to visualize how the algorithms search through data. The application provides an interactive and engaging way to understand searching techniques in computer science.
"Graph Traversing Visualizer (BFS, DFS)",Python,https://github.com/SamarpanCoder2002/Graph-Traversing-Visualizer,The Graph Traversal Visualizer is a Python Tkinter application that visually demonstrates the Breadth-First Search (BFS) and Depth-First Search (DFS) algorithms. It allows users to explore how these algorithms traverse a graph step by step. The application provides an interactive way to better understand graph traversal techniques.
Circular Queue Visualizer,Python,https://github.com/SamarpanCoder2002/Circular-Queue-Visualizer,The Circular Queue Visualizer is a Python Tkinter application that helps visualize the insertion and deletion operations in a circular queue. It provides an interactive representation of how elements are added and removed in the queue. This tool makes it easier to understand the circular queue concept by demonstrating its behavior in real-time.
Link-List Visualizer,Python,https://github.com/SamarpanCoder2002/Singly-Link-List-Visualizer,"The Singly Linked List Visualizer is a Python Tkinter application that demonstrates various operations on a singly linked list, such as insertion and deletion at both ends and inserting or deleting nodes at specific positions. The visualizer helps users understand how the linked list structure changes with each operation in real-time. It provides an interactive and educational experience for learning about linked list data structures."
Music Player,Python,https://github.com/das88768/music-player,"The Music Player is a Python-based GUI application built using Tkinter and Pygame, allowing users to play music directly from their computer. It features a simple interface where users can load a directory of songs, create a playlist, and play selected tracks. The app also utilizes Audio Metadata to display song information and supports essential controls like play, pause, and stop."
Currency Converter,Python,https://github.com/gerardo5797/PythonCurrencyConverter,"The Python Currency Converter is a program that fetches real-time currency conversion rates using the Frankfurter API. It allows users to convert between two specified currencies and provides both the direct and inverse conversion rates. The project consists of multiple Python scripts for handling API calls, validating currency codes, and testing functionality."
Cone Detection,Python,https://github.com/alexandsquirrel/cone-detection,"This project develops a perception pipeline for detecting the exact locations of cones for a formula racing car using camera input. It involves two stages: first, detecting bounding boxes around cones with YOLOv3, and second, precisely locating cones within those boxes using traditional computer vision techniques. Future work includes improving the model with more data and integrating 3D cone localization for SLAM."
Random quote generator,Python,https://github.com/Mahitej28/Random-Quote-Generator,"This project is a random quote generator that fetches quotes from a public API using the requests library. The generate_quote() function makes a GET request, extracts the data in JSON format, and displays a randomly selected quote. It handles errors gracefully and can be extended to use datasets from Kaggle."
Snake Water Gun game,Python,https://github.com/sagargoswami2001/Snake-Water-Gun,"The Snake Water Gun game is a Python implementation where a single player competes against the computer. Players randomly choose between snake, water, or gun, with predefined winning conditions. The game uses the random module to simulate the computer's choices and determine the winner."
URL shortener,Python,https://github.com/amitt001/pygmy,"Pygmy project, an open-source URL shortener built with Python. The document outlines setup instructions, features, technical information, and steps for using the API, among other details."
Youtube Video Downloader,Python,https://github.com/pytube/pytube,"Pytube is a lightweight, dependency-free Python library for downloading YouTube videos. It supports both progressive and DASH streams, playlist downloads, and caption track extraction. The library also includes a command-line utility for quick video downloads."
Log Analyser,Python,https://github.com/yurilaaziz/log-analyzer,"Log-analyzer is a simple and efficient log analyzer designed for rapid troubleshooting. It reads and processes log files, displaying data by hits and supporting custom alert rules. The tool also offers flexible configuration options and supports multiple log sources and persistence drivers."
PDF To DOCX Converter,Python,https://github.com/ArtifexSoftware/pdf2docx,"pdf2docx is a Python tool for converting PDF files to DOCX format, preserving layout, text, images, and tables. It supports extracting data using PyMuPDF and recreating page elements like paragraphs, headers, footers, and tables. The library also offers multi-processing for efficient parsing and extraction of complex content, including nested tables."
AI Resume Analyzer,Python,https://github.com/deepakpadhi986/AI-Resume-Analyzer,"AI Resume Analyzer. This tool uses Natural Language Processing (NLP) to analyze resumes, extract information like keywords, skills, and job roles, and provides recommendations and predictions to enhance the resume. It appears to be part of a project submission for a Bachelor's degree, and it utilizes technologies like Streamlit, Python, MySQL, and several NLP modules like NLTK and Pyresparser."
Hotel Management System,Python,https://github.com/tushar-2223/Hotel-Management-System,"The Hotel Management System is a simple website allowing users to book rooms for specific dates, while the admin can manage room details. Built using HTML, CSS, JavaScript, PHP, and Bootstrap, it includes a content management system. The app is supported on both Windows (using XAMPP) and Linux (via a setup script)."
Facial Recognition Attendance System,Python,https://github.com/Vatshayan/Face-recognition-Attendance-System-Project,"The Face Recognition Attendance System is an automated solution for marking student attendance using facial recognition technology. It captures live video streams, detects faces with OpenCV, and compares them with stored student images to mark attendance. The system eliminates proxy attendance and enhances the accuracy of attendance management in educational institutions."
Find Missing Person using AI,Python,https://github.com/gaganmanku96/Finding-missing-person-using-AI,"The ""Finding Missing Person using AI"" project aims to help authorities quickly track missing individuals using facial recognition. It allows users to submit images of missing or found people via a mobile app, which are then matched with registered cases using a KNN algorithm. The system streamlines the process by leveraging AI to analyze and match faces, providing a more efficient method for solving missing person cases."
Recipe Generation from Food Image,Python,https://github.com/navassherif98/Recipe-Generation-from-Food-Image,"The ""Recipe Generation from Food Image"" project uses deep learning to analyze food images and generate detailed cooking recipes. It extracts key information such as the recipe title, ingredients, and step-by-step instructions from images of dishes. The system leverages computer vision and natural language generation for a seamless and user-friendly experience, allowing users to discover new recipes by simply snapping a picture of their favorite food."
Gesture Controlled Virtual Mouse,Python,https://github.com/Viral-Doshi/Gesture-Controlled-Virtual-Mouse,"Gesture Controlled Virtual Mouse project that allows users to control a computer using hand gestures and voice commands. The project utilizes machine learning and computer vision techniques to recognize various gestures and execute commands, making it possible to perform mouse actions, volume control, and other operations without direct contact with the computer."
Attendance System,Java,https://github.com/pally2409/Attendance-Management-System,"This Java-based attendance management system helps students track their total lectures and days missed. It calculates the attendance percentage and provides a warning if the attendance criteria are not met. Additionally, it displays the number of classes required to fulfill the attendance requirements."
Calculator using Swing,Java,https://github.com/AHBRIJESH/Calculator-Using-java,"This project is a simple calculator application built using Java Swing, supporting basic arithmetic operations like addition, subtraction, multiplication, and division. It features a user-friendly interface with real-time calculations and a reset button. The calculator is implemented in Java with a graphical interface using Swing components and event handling."
Library Management System,Java,https://github.com/harismuneer/Library-Management-System-JAVA,"The Library Management System is a Java-based project designed using Object-Oriented Analysis and Design principles, with a console-based interface. It includes functionalities for Borrowers, Checkout Clerks, Librarians, and Administrators to manage library operations like book search, checkout, renewal, and user management. The system is supported by a Java DB (Derby) and comes with a class diagram, database schema, and setup instructions for easy deployment."
Payroll Management System,Java,https://github.com/sahiljagtap08/Payroll-System-JAVA,"The Payroll System is a desktop application built using Java, Spring, AWT, JDBC, and MySQL to manage employee data and calculate salaries. It features secure login, the ability to add/edit/delete employee details, and generates payslips automatically. The system also allows administrators to view and manage employee information and salary details efficiently."
Email Administration using Core Java,Java,https://github.com/rgovil17/Email-Administration-Application,"The Email Administration Application is a Java project designed to create email accounts for new hires with a specified format. It generates an email address based on the employees name and department, creates a random password, and allows for customization of mailbox capacity and alternate email addresses. The system also includes methods to modify the password and display user information."
Symmetric Encryption Cyptography,Java,https://github.com/asadkhan-786-gb/Symmetric-Encryption-Cryptography-in-Java,"The Symmetric Encryption Cryptography project in Java focuses on implementing encryption algorithms for securing files or text. It uses Java's security module and cryptographic techniques to encrypt and decrypt data. The project involves understanding Java programming fundamentals, Java servlets, and the deployment of encryption systems on local servers."
Snake Game,Java,https://github.com/janbodnar/Java-Snake-Game,The Java Snake Game is a classic implementation of the popular Snake game using Java. Players control the snake to eat food while avoiding collisions with walls and the snake's own body. The game features simple graphics and real-time gameplay with increasing difficulty as the snake grows.
Tic-Tac-Toe Game using Swing,Java,https://github.com/ImKennyYip/tictactoe-java,"The Tic Tac Toe game in Java is a beginner-friendly project that uses the AWT and Swing graphics libraries to create a graphical user interface (GUI). It allows two players to play the game, checking for win or tie conditions using a 2D array. Additional features like a restart button and score tracking can be added for an enhanced experience."
Sentiment Analysis,R,https://github.com/meetttttt/Sentiment-Analysis-in-R-programming,"This R project demonstrates sentiment analysis by processing text data to extract insights such as word frequency, word clouds, and sentiment scores. It utilizes various R packages for text mining, natural language processing, and emotion classification to analyze reviews and determine the overall sentiment and emotional tone. The project provides a detailed workflow for analyzing customer feedback and understanding sentiments in textual data."
Uber Data Analysis,R,https://github.com/AmirMotefaker/Uber-Data-Analysis,"This project analyzes Uber data from April to September 2014, focusing on visualizing patterns and insights using R's ggplot2, dplyr, and other packages. It explores factors like ride demand, driver allocation, and dynamic pricing to understand customer behavior and optimize service. The project emphasizes data visualization techniques to communicate complex insights and guide decision-making."
Movie Recommendation System,R,https://github.com/Rpita623/Movie-Recommendation-System-using-R_Project,"This project builds a movie recommendation system using Item-Based Collaborative Filtering with the MovieLens dataset in R. It preprocesses data, applies similarity measures like cosine and Pearson, and visualizes results through heatmaps and bar plots. The system recommends movies to users based on their preferences and similar ratings from others."
Customer Segmentation,R,https://github.com/aimee0317/customer-segmentation-R,"This project uses the K-means clustering algorithm to segment customers based on a dataset with 6718 rows of customer data. The analysis involves preprocessing the data, applying K-means clustering, and visualizing the clusters with clusplot. It aims to identify distinct customer segments to inform business strategies."
Credit Card Fraud Detection,R,https://github.com/shalakasaraogi/credit-card-fraud-detection/tree/main,"This project focuses on detecting credit card fraud using machine learning techniques to analyze transaction data. It addresses challenges like unbalanced data by applying methods such as Random Over-Sampling (ROS), Random Under-Sampling (RUS), and SMOTE. The goal is to predict fraudulent transactions using R, with the dataset containing transaction information and labels for fraud detection."
Book Library App,Mobile Applications,https://github.com/rohanrao619/Library_Management_Android_App,"This Android app is designed to manage a library system, allowing both users and admins to perform various operations such as issuing, returning, and searching books, and managing fines. It uses Firebase for backend services like Firestore, Cloud Functions, and Firebase Cloud Messaging for real-time notifications. The app provides an intuitive interface and automates tasks such as fine collection and overdue reminders."
Novel Library App,Mobile Applications,https://github.com/gmathi/NovelLibrary,"Novel Library is an app that provides a one-stop platform for reading all types of novels. It allows users to access and read novels with an easy-to-use interface, supporting extensions for enhanced functionality. The app is integrated with Firebase and includes setup instructions for project files and extensions."
Women Safety App,Mobile Applications,https://github.com/HassamTalha/Amaan-Women-Safety-App,"""Amaan - You Deserve to be Safe!"" is a womens safety mobile app developed by Google DSC COMSATS University Islamabad. The app offers features like location tracking, SOS alerts, and emergency helplines to empower and protect women. Future plans include adding audio recording for evidence and collaborating with the government to overcome SMS charges."
Notes App,Mobile Applications,https://github.com/CheezyCode/YetAnotherNotesApp,"""Yet Another Notes App"" is an Android app designed for note-taking with features like MVVM setup, HILT, Coroutines, and API integration using Retrofit. It includes a complete signup/login flow and authenticated API calls with interceptors. The project is part of a tutorial series that covers both Android development and Node.js-based REST API integration."
Snake Game,Mobile Applications,https://github.com/codepath/android_snake_game,"The ""Android Snake Game"" is a simple 2D snake game for Android, reminiscent of the classic game played in the 90s. The project requires integrating the android_simple_game_engine by copying its Java files into the game directory. It's a fun and nostalgic game designed to pass the time."
Shopping App,Mobile Applications,https://github.com/alireza4585/Flutter-Shopping-App,"This project is a shopping app developed using Flutter and Firebase, featuring both a user-friendly UI and backend functionality. It allows users to browse products, manage their cart, and make purchases. A tutorial for building the app is available on YouTube."
Flappy Bird,Mobile Applications,https://github.com/VadimBoev/FlappyBird,"This project is a Flappy Bird clone developed in C for Android, with an APK size under 100 KB. It uses OpenGL ES 2, shaders, and Android Native Activity, along with compressed MP3 sounds and PNG decoding via the upng library. The project aims to create a minimalistic and efficient game, while being inspired by various tools and libraries like Raylib and ImGui."
Alarm App,Mobile Applications,https://github.com/Adw41t/Simple_Alarm_Clock,The Simple Alarm Clock app demonstrates the use of MVVM architecture and Room persistence library. It allows users to set one-time or repeating alarms with a straightforward user interface. The app showcases essential Android development concepts like data persistence and architecture patterns.
Stopwatch App,Mobile Applications,https://github.com/stevdza-san/Stopwatch-Android-App,The Stopwatch app is built with Jetpack Compose and uses foreground and bound services to track time even when the app is closed. It features a simple UI with buttons to control the stopwatch and reset it via notifications. The project also integrates Dagger-Hilt for dependency injection and demonstrates Android service management.
Calendar App,Mobile Applications,https://github.com/SimpleMobileTools/Simple-Calendar,"Simple Calendar 2023 is an offline, highly customizable Android calendar app that helps users organize their schedule with features like event syncing via Google Calendar, reminders, and a variety of widgets. It offers a clutter-free experience with no ads, supports event imports, and allows for personalized event creation. The app is ideal for managing daily, weekly, and monthly agendas, making it a perfect planner for both personal and business use."
WhatsApp Clone (+Backend),Mobile Applications,https://github.com/SekhGulamMainuddin/WhatsAppCloneFlutter,"This project is a WhatsApp clone built using Flutter, featuring chat functionality, single/group chats, and audio/video calls. The app integrates Firebase for backend services and uses Agora for real-time audio and video calling. It also supports content sharing like images, videos, and GIFs, with additional libraries for enhanced functionality."
Twitter Clone (+Backend),Mobile Applications,https://github.com/Chevinjeon/TwitterClone,"X Clone is a social networking app inspired by Twitter, built using Kotlin and Firebase for user management, profiles, tweets, and direct messaging. The app features functionalities like creating posts with images/videos, retweeting, and sending DMs. The UI is updated to match Twitter's Android app design, offering a seamless user experience."
Instagram Clone (+Backend),Mobile Applications,https://github.com/mitchtabian/Android-Instagram-Clone,"This project is a step-by-step guide to building an Instagram clone for Android using Firebase for authentication, database, and cloud storage. The app includes features like profile management, image sharing, comments, likes, and user interactions. The course covers essential Android concepts like navigation, fragments, and Firebase integration, offering a practical way to learn app development."
Weather App,Mobile Applications,https://github.com/dev-aniketj/WeatherApp-Android,"This Weather App is built using Java and fetches weather data from the OpenWeatherMap API. It provides current weather, forecasts, and weather alerts by using a unique API key. The app is simple, user-friendly, and allows easy contribution through GitHub."
Quiz App,Mobile Applications,https://github.com/hellosagar/Quiz-App,"The Quiz App is an Android application built with Java, offering quizzes in subjects like Maths, Geography, and Literature. It tracks quiz history using the Room Persistence Library and supports user authentication, password changes, and displaying results. The app utilizes AsyncTask for asynchronous operations and includes features like a loading indicator and SQLite database management."
Stock Market Analyzer,Mobile Applications,https://github.com/rehmanis/stocks-android,"The Stocks Android App is a virtual stock trading platform that allows users to search for company stocks, buy/sell stocks, and manage portfolios. It integrates with a custom Node.js backend using the Tiingo API for stock data and the News API for stock-related news. Features include SMA charts, news sharing, and saving stock data locally for persistence."
Document Scanner,Mobile Applications,https://github.com/SDA-SE/document-scanner-android,"The Android Document Scanner is a library that enables users to scan documents such as notes, business cards, and receipts. It offers features like cropping, limiting the number of scans, and automatically accepting document corners without user adjustments. The library can be used with both Kotlin and Java, making it versatile for different Android projects."
Medication Reminder,Mobile Applications,https://github.com/waseefakhtar/dose-android,"The Dose App is an Android medication reminder app built using Jetpack Compose, Material Design 3, and various Android libraries like Room, Hilt, and Firebase. It helps users stay on track with their medication schedule by sending timely reminders. The app is open for contributions and feedback, with a focus on collaboration and improvement."
Calculator App,Mobile Applications,https://github.com/forzzzzz/Calculator-You,"Calculator You is a versatile Android app offering a beautiful, customizable calculator with over 60 color themes. It features a scientific mode, unit converter, and a history tracker for efficient calculations. The app also supports translations and donations, with an active community on Telegram for updates."
Hangman Game,Mobile Applications,https://github.com/laurensV/Hangman,"Hangman is an Android app based on the classic Hangman game, featuring a user-friendly interface with placeholders for unguessed letters, a guessing limit, and a history of high scores. It allows users to customize settings like word length and max incorrect guesses. The app uses Android SDK and Canvas for graphics, providing an interactive and engaging experience."
Audiobook,Mobile Applications,https://github.com/homielab/audiobookapp,"The Audiobook App is an open-source mobile application built with React Native, supporting both Android and iOS platforms. It allows users to listen to audiobooks and features a clean, modern UX/UI with full audio playback support. The app leverages libraries like React Navigation and React Native Sound for seamless navigation and audio functionality."
Calories Counting App,Mobile Applications,https://github.com/simonoppowa/OpenNutriTracker,"OpenNutriTracker is an open-source mobile app designed for easy nutritional tracking and meal management. It allows users to log meals, track nutrition, create custom meal plans, and scan barcodes for instant food information, all while maintaining privacy. The app is free, with no ads or subscriptions, and prioritizes data security with local encryption."
Restaurant App (with API),Mobile Applications,https://github.com/CristianoYL/RestaurantAndroidApp,"This Android app allows users to register, browse restaurant menus, and place food orders online. It integrates with Google Maps for location services, Stripe for payment processing, and includes features like viewing restaurant details and managing orders. The app communicates with a REST API backend for real-time order processing and payment security."
Expense Tracker App,Mobile Applications,https://github.com/Abhishek111883/Android-project,"The Expense Tracker Android app helps users efficiently manage their finances by tracking expenses, setting budgets, and monitoring income. It features secure authentication, receipt scanning, multi-currency support, and expense analysis through charts and reports. The app uses Firebase for data storage and provides a user-friendly interface for managing finances on the go."
