title,category,reference,summary
Android Document Sharing System using Blockchain,Blockchain,https://github.com/ruchi26/Blockchain-based-Decentralized-File-Sharing-System-using-IPFS,"The Blockchain-based File Sharing System enables decentralized file sharing using a blockchain and peer-to-peer (P2P) network. Files are encrypted using AES encryption and stored on the IPFS network, while the blockchain records the file hashes for security and integrity. The system ensures only authorized users with valid file keys can access the shared files, enhancing privacy and data protection."
State Government Fund Allocation & Tracking System over Blockchain,Blockchain,https://github.com/maddydevgits/government-fund-allocation-tracking-system-blockchain,"The Government Fund Allocation and Tracking System utilizes blockchain technology to track and manage government funds efficiently. The project involves compiling and migrating smart contracts using Truffle and Ganache, with a Python-based backend to run the server. The system allows for transparent and secure fund allocation tracking through smart contracts."
Document Storage System,Blockchain,https://github.com/codingBeast25/Blockchain-based-File-Storage,"This project implements a decentralized file storage system using blockchain technology, where users can upload and download files securely. Files are stored in blocks that are appended to the blockchain, ensuring they cannot be altered or deleted. The system uses the Proof of Work algorithm to validate new blocks, and different methods of nonce generation are compared for efficiency and security."
Charity Applications,Blockchain,https://github.com/harshagr18/CharityBlockchain,"The Charity Blockchain Project uses Solidity, Web3, and Metamask to create a transparent and secure platform for charity organizations to manage transactions and expenditure records. It leverages Ganache for local Ethereum blockchain development and allows users to mine transactions into blocks. The project aims to enhance accessibility and transparency for charities, especially smaller organizations."
Simple Voting Dapp,Blockchain,https://github.com/ashishlamsal/voting-dapp,"The Blockchain-Based Voting System is a decentralized application (DApp) built with React and Solidity, utilizing Ethereum blockchain for secure, transparent, and trustless voting. The system allows an admin to add voters and candidates, start and end elections, and display results in real-time. It serves as a proof of concept for blockchain-based voting, focusing on security and immutability."
Digital Land Registry System,Blockchain,https://github.com/vrii14/Land-Registration-with-Blockchain,"The Land Registration System with Blockchain is a decentralized application built using Ethereum, React, and Solidity to streamline land registration and transfer processes. It allows sellers, buyers, and land inspectors to securely register, verify, and transfer land ownership with immutable records on the blockchain. The system aims to reduce fraud, accelerate transactions, and provide transparency in land dealings."
Personal Identity System,Blockchain,https://github.com/jibolagithub/Blockchain-Based-personal-identity-security-system,"The Blockchain-Based Digital Identity System uses blockchain technology to securely store and manage personal identity information, including biometric data, ensuring privacy and preventing unauthorized access. Implemented with Ethereum smart contracts, the system provides a highly secure and transparent digital identity solution for individuals. This system can be beneficial for governments, offering citizens a hassle-free, paperless way to manage their identity securely."
Supply Chain Management System,Blockchain,https://github.com/Faizack/Supply-Chain-Blockchain,"This project implements a supply chain management system using blockchain technology and smart contracts written in Solidity. The smart contract ensures transparency and secure product transfer from manufacturers to customers. The frontend communicates with the blockchain using Web3.js, and the application is deployed on the Gode Testnet using Truffle.js."
Medical UseCase,Blockchain,https://github.com/IBM/Medical-Blockchain,"This code pattern demonstrates how to build a blockchain-based solution for managing and securing medical data, specifically electronic medical records (EMRs), for various stakeholders, including admins, doctors, and patients. The architecture is designed to provide a secure, decentralized approach to data management using IBM Blockchain technologies, and integrates various modern tools such as VueJS, NodeJS, Redis, Docker, and Kubernetes to create a comprehensive system."
Todo App,Python-Django,https://github.com/shreys7/django-todo,"This is a simple Todo app built with Django, where users can manage tasks. It includes user authentication via an admin panel and allows task management through a web interface. Setup involves cloning the repo, applying migrations, creating a superuser, and running the server locally."
Password Generator,Python-Django,https://github.com/vinit-modi/Django-Password-Generator,"The Django Password Generator is a web application that creates secure, random passwords based on user-selected criteria such as uppercase letters, special characters, and numbers. Users can also customize the length of the generated password. The app is built using Django and Bootstrap, providing a dynamic and user-friendly interface."
Personal Portfolio,Python-Django,https://github.com/BurhanMohammad/Django-Portfolio-website,"This project is a personal portfolio website built with Django for the backend and HTML, CSS, JavaScript, and Bootstrap for the frontend. It features dynamic content management through an admin interface, along with a light/dark mode toggle, live previews, and fullscreen mode. The website showcases the developer's skills and provides easy local deployment through Django's server."
Stone Paper Scissor,Python-Django,https://github.com/ShivamRohilllaa/rock-paper-scissors,"This project is a Rock, Paper, Scissors game built with Python and Django. It allows users to play the game online through a web interface, providing real-time results after each round. The game is deployed live on Heroku, and the code can be run locally by installing dependencies from the requirements file."
Billing System,Python-Django,https://github.com/mohdishaq786/Django-Billing-system,"The Django Billing System project is designed to help educational institutes maintain student billing records with a simple interface. It allows for easy management and tracking of various billing entries. The project uses Python and Django, with setup instructions for creating a virtual environment and running the server."
Movie Ticket Booking System,Python-Django,https://github.com/bhaskars9/bookmyticket,"The BookMyTicket application allows users to book movie tickets, with features for both theatre staff and end users. Theatre staff can manage movies and shows, while customers can create accounts and book tickets. The application is developed using Django and PostgreSQL, providing a dynamic system for movie ticket bookings."
Email Sender,Python-Django,https://github.com/sukanya-pai/Django-Email-Sender,"The Django-Email-Sender project allows you to send emails from a Gmail account using Django and HTML templates. It involves setting up a virtual environment, installing dependencies, and configuring Gmail app passwords for security. The app enables sending emails via an API endpoint by customizing the sender and recipient details in the views.py and settings.py files."
Web Scraper,Python-Django,https://github.com/shubham17sm/web-scraping-django,web-scraping-django is a news aggregator app built with Django and BeautifulSoup to scrape news articles from the web. It uses Celery as a task queue to save scraped articles in the database and provides an API through Django Rest Framework. The project allows users to view the scraped news articles and manage them via the admin interface.
Palindrome Checker,Python-Django,https://github.com/ramshree/palindromer-checker,"palindromer-checker is a Django/Python app that validates whether a given string is a palindrome. The app is set up with Python 3, Django, and virtualenv, and can be hosted on Heroku for easy deployment. It provides functionality to check palindrome strings and includes setup instructions for macOS, along with testing and deployment details."
Sorting Visualizer,Python-Django,https://github.com/jntushar/Sorting-Visualizer,"Sorting-Visualizer is a web application built with Django and Python to visualize various sorting algorithms in action. The tool allows users to interact with and watch sorting algorithms like bubble sort, quick sort, and more."
Reminder System,Python-Django,https://github.com/arianshnsz/Django-Task-Reminder,"Django Task Reminder is a to-do list management application that allows users to add, modify, finish, and remove tasks, as well as assign them to others and set reminders. It integrates with a DWR-910 4G LTE USB Router to send SMS notifications for task reminders. The project also provides instructions for setting up the environment, database, and running the server, with plans to enhance features like SIM800 module integration and international phone number validation."
Automatic Birthdays Mailer,Python-Django,https://github.com/ashutoshkrris/PyWisher,"PyWisher is a Django-based app that helps users remember birthdays by sending automatic email wishes every year. Users can upload an Excel sheet or manually add birthday data, and PyWisher will manage the reminders and email notifications."
Snake Water Gun Game,Python-Django,https://github.com/sagargoswami2001/Snake-Water-Gun,"The Snake Water Gun game is a Python implementation of the classic two-player game, where a single player competes against the computer. Players choose between snake, water, or gun, and the game follows specific rules to determine the winner. The Python project utilizes the random module to simulate the computer's choices and evaluate the game outcome."
Mobile Assistant,Python-Django,https://github.com/vintasoftware/django-ai-assistant/,"Django AI Assistant combines the power of large language models (LLMs) with Django to create intelligent applications. It allows AI assistants to call Django methods, enabling advanced features like AI Tool Calling and Retrieval-Augmented Generation (RAG). The project is open-source and provides documentation and a community for collaboration."
Calculator,Python-Django,https://github.com/BurhanMohammad/Django-Calculator,"Django Calculator is a simple web application built with Django that offers basic calculator functions like addition, subtraction, multiplication, and division. The app features a responsive design for mobile-friendly usage. It is open-source and can be installed locally by following the setup instructions provided in the repository."
CRUD REST API in Flask and MongoDB,Python-Django,https://github.com/rishi772001/Django-MongoDb-CRUD-RESTAPI,"Django-MongoDB-CRUD-RESTAPI is a web application that allows basic CRUD operations for student marks and totals using MongoDB as the database. It provides a RESTful API to manage student details, deployed in a Docker container for easy infrastructure management. The app uses Django, Djongo, and Django Rest Framework to create and interact with the MongoDB database."
Calorie Counter,Python-Django,https://github.com/nitish-gautam/django-calorie-tracker,"The Django-Calorie-Tracker is a web application built with Django that helps users track their calorie intake and consumption. The project uses Python, Bootstrap, HTML, JavaScript, and CSS to create an intuitive interface for managing daily calorie data. The app allows users to log and monitor their dietary habits effectively."
Student Management System,Python-Django,https://github.com/jobic10/student-management-using-django,"The Django-based Student Management System allows admins, staff, and students to manage and track various aspects of student data, including attendance, results, and feedback. Features include user authentication, role-based access, attendance management, result tracking, and feedback handling. The system also offers a clean, responsive UI and is deployed on Heroku for easy access."
Social Media backend,Python-Django,https://github.com/Ronik22/Django_Social_Network_App,"The Django Social Network is a web application that offers features like user authentication, profile management, and social interactions such as posts, likes, comments, and following. It also includes chat functionality using WebSockets, video calls, and friend requests. The app supports OAuth logins, notifications, and can be deployed on Heroku."
Content Management system,Python-Django,https://github.com/django-cms/django-cms,"Django CMS is an open-source content management system built on the Django framework, offering features like multilingual support, hierarchical pages, version control, and frontend content editing. It supports multi-site configurations, SEO-friendly URLs, and can be integrated with other applications. The project is community-driven and backed by the non-profit Django CMS Association."
Tic-Tac-Toe Game,C++,https://github.com/ramanbansal9876/Tic-Tac-Toe-Game-using-Cpp,"This project is a Tic-Tac-Toe game developed using C++ and Object-Oriented Programming (OOP) concepts. It allows two players to take turns placing ""X"" or ""O"" on a 3x3 grid, aiming to align three marks in a row, column, or diagonal to win. The game ends either with one player winning or a draw if all positions are filled without a winner."
Chess Game,C++,https://github.com/jironghuang/chess,"This project is a C++ implementation of a 2-player chess game using Object-Oriented Programming (OOP) principles. It simulates a full chess game, allowing two players to move pieces according to standard chess rules. The program handles the game's logic, including piece movement, captures, and check/checkmate conditions."
Library Management System,C++,https://github.com/abdulsamie10/Library-Management-System,"The Library Management System in C++ is a console-based application allowing both admins and students to manage library resources. Admins can add, edit, and view books, as well as manage student accounts and balances, while students can register, issue books, and track their balances. The system uses 2D arrays to store data and implements core C++ features like functions, loops, and conditional statements."
File Management System,C++,https://github.com/krshrimali/CPP-File-Manager,"The CPP-File-Manager is a C++ tool that lists files, generates a tree-like directory structure, and supports ignoring specific directories and file extensions. It allows users to output the directory structure in a customizable format for integration into Markdown files. The program also provides functions for managing file paths, clearing memory, and writing the directory tree to a text file."
Restaurant Ordering System,C++,https://github.com/TzeYuan14/Food-Ordering-System,"The Food Ordering System allows restaurant managers to manage the menu, track orders, and calculate sales, while customers can place orders and make payments online. The system provides functionalities like updating prices, calculating delivery times, and tracking popular dishes. It ensures smooth restaurant operations during challenging times like the COVID-19 pandemic by enabling efficient food delivery and order management."
Alumni Management System,C++,https://github.com/ali-soban/alumni_management_system_cpp,"The DSA_PROJ is an alumni management system that utilizes data structures like Linked Lists and Queues to manage student records. It allows for CRUD operations, enabling the addition, updating, deletion, and editing of alumni data. The project demonstrates the application of fundamental data structures in real-world systems."
Gym Management System,C++,https://github.com/DhanushAnbalagan/Gym-Management-System,"The Gym Management System is a C++ application that allows administrators to manage gym memberships, including creating, viewing, modifying, canceling, and searching for memberships. It uses input validation and dynamic storage with vectors to ensure efficient handling of membership data. The system provides a user-friendly menu interface for easy navigation and operation."
File Compression,C++,https://github.com/aniketpathak028/File-Compressor,"The File Compressor is a C++ application that uses Huffman Coding to compress and decompress text files in a lossless manner. It efficiently reduces file size by encoding the text and reconstructs the original file during decompression. The program provides simple commands for both compressing and decompressing text files, making it easy to use."
Implementation of Minesweeper Game,C++,https://github.com/burakssen/minesweeper,"This is a simple minesweeper game implemented in C++ using the raylib library for rendering and input handling. Players interact with the game using the mouse to reveal or flag tiles, aiming to avoid mines and clear all non-mined tiles. The game can be built and run via CMake, with assets and sound effects sourced from external libraries."
Program to remotely Power On a PC over the internet using the Wake-on-LAN protocol,C++,https://github.com/herzhenr/simple-wake-on-lan,"SimpleWoL is a cross-platform mobile application built with Flutter that allows users to send Wake On Lan (WoL) packets to remotely wake up devices over a network. The app features automatic device discovery, a user-friendly interface, and the ability to export/import device data in JSON format. Available on both Android and iOS, it simplifies the process of managing remote wake-up functionality."
Finding cabs nearby using Great Circle Distance formula,C++,https://github.com/Nirbhay-Gaur/ride-o-meter,"Ride-O-Meter is a program that calculates the proximity of cabs to a user's location based on GPS coordinates, identifying cabs within a 50 km radius. It processes input data from a JSON file containing cab details and computes the distance using the Great Circle Distance formula. The program outputs the user-id and name of nearby cab drivers to a new JSON file."
Snake Game,C++,https://github.com/KaranJagtiani/Snake-Game-in-CPP,"This Snake game, implemented in C++ using the graphics.h library, utilizes a doubly linked list to manage the snake's body and ensure smooth movement. The game also incorporates a Forest Fire algorithm for polygon filling using a queue data structure based on a linked list. The algorithm ensures efficient pixel manipulation for filling areas in the game interface."
Facial recognition using Python OpenCV library,Python,https://github.com/informramiz/opencv-face-recognition-python,"Tutorial to perform face recognition using OpenCV and Python. You've covered the theory behind the various face recognition algorithms, such as EigenFaces, FisherFaces, and LBPH (Local Binary Patterns Histograms). Now, you're moving into the practical part, explaining how to gather training data, train a face recognizer, and test it with new images."
Magic 8 Ball,Python,https://github.com/Vaibhavabhaysharma/Magic-8-Ball-Game-by-Python/tree/master,"The Magic 8 Ball game is recreated using Python, allowing users to ask questions and receive random answers. It leverages Python's random function to simulate the classic 90's game experience. Additionally, the game records each question asked in a CSV file for later reference."
Sudoku Solver,Python,https://github.com/dhhruv/Sudoku-Solver,"The Sudoku Solver is a Python-based tool that quickly solves Sudoku puzzles using a backtracking algorithm and visualizes the solution process. It features a user-friendly GUI for puzzle input, options for hints, and a solver that works in seconds. Perfect for enhancing cognitive skills, this tool offers an easy and interactive way to enjoy and solve Sudoku puzzles."
Ping Pong Game,Python,https://github.com/prathameshparit/Ping-Pong-Game,"The Ping Pong Game is a two-player game created using Python and Tkinter, where players control paddles to hit the ball back and forth, aiming to score points. Players can move the left paddle using 'w' and 's' keys and the right paddle with the arrow keys. The game features customizable settings like ball speed and paddle size through a config file."
3D AR with Python (OpenCV and NumPy),Python,https://github.com/jayantjain100/Augmented-Reality,"The Augmented Reality project uses OpenCV to render .obj files on Aruco markers, providing an interactive AR experience. It allows the detection and display of 3D objects on printed markers using a Python program. The project includes camera calibration and tracking features for improved marker detection and tracking performance."
Attend Zoom Meetings Automatically,Python,https://github.com/YarinCodes/auto-zoom-meetings-join,"This Python script automates the process of joining Zoom meetings using image recognition. It allows the user to join meetings without audio or video, enabling them to attend without interrupting their sleep. The script requires meeting details in an Excel file and Zoom installation for functionality."
Message Encrypter,Python,https://github.com/Rupa-Veerala/Secret-Message-Encryption-Decryption-using-Python,"This Python project enables encryption and decryption of secret messages to ensure privacy and security. It converts plain text into ciphertext, making it unreadable to unauthorized users. The message can only be decrypted by someone with the correct password or key, ensuring safe communication."
Virtual Assistant,Python,https://github.com/ashutoshkrris/Virtual-Personal-Assistant-using-Python,"This project involves building a personal AI assistant using Python, similar to Jarvis from Iron Man. It allows functionality like weather updates, news fetching, and movie recommendations, integrating APIs such as OpenWeather, NewsAPI, and TMDB. Users can customize the assistant by filling in their details in the .env file."
Automatic Quote Generator (using Quotes API),Python,https://github.com/Mahitej28/Random-Quote-Generator,This project uses Python's requests library to fetch random quotes from a public API endpoint. The generate_quote() function handles the API request and displays a random quote to the user. It also includes error handling to ensure smooth execution.
Guessing Game,Python,https://github.com/tombh/Python-Stuff/tree/master/Numer%20Guessing%20Game,"This project showcases a collection of random Python projects created by the author. It includes various small utilities and scripts demonstrating different Python functionalities. The projects range from simple tasks like generating quotes to more complex functionalities, serving as a portfolio of the author's work in Python."
Hangman Game,Python,https://github.com/meet244/Hangman-game,"This project is a Python implementation of the classic Hangman game using the tkinter library for the graphical interface. Players guess a hidden word by entering letters, with a limited number of incorrect guesses before losing the game. The game includes sound effects and allows players to retry or exit after a win or loss."
Tic-Tac-Toe Game,Python,https://github.com/aqeelanwar/Tic-Tac-Toe,"This project is a Python-based interactive Tic-Tac-Toe game that allows two players to compete on a grid. Players take turns placing their symbols (X or O), and the game tracks the score while displaying the result at the end. The game can be restarted by clicking anywhere on the result screen."
Stock Scanner,Python,https://github.com/pranjal-joshi/Screeni-py,"Screeni-py is an open-source project for screen recording and live streaming with support for multiple platforms (Windows, Linux, Mac OS, and Docker). It includes features like automatic video compression, seamless integration with Docker, and real-time streaming capabilities. The project is actively maintained, with resources for documentation, discussions, and issue reporting available on GitHub."
Random Password Generator,Python,https://github.com/Ramesh-Bhutka/-Python-Random-Password-Generator-,This project includes two Python scripts for generating random passwords. The simple_password_generator.py generates a 16-digit password using the string and random libraries. The Gui_password_generator.py creates a 15-digit password with a graphical user interface built using the tkinter library.
Stack-Visualizer,Python,https://github.com/SamarpanCoder2002/Stack-Visualizer,"This project is a Stack Visualizer built using Python's Tkinter and Pillow libraries. It demonstrates the Push and Pop operations of a stack with visual representation, allowing users to interact with and visualize stack operations. The application is complete and provides an engaging way to understand stack data structures."
Track Phone Number Location,Python,https://github.com/problemsolvewithridoy/Phone-number-location-tracker-using-python,"This project demonstrates how to track the location of a mobile number using Python with libraries like phonenumbers, geocoder, and folium. It uses a Geocoder API to fetch the location and display it on a map. However, the method is intended for educational purposes and may not be effective for real-world use, as tracking someone's location without consent is illegal in many cases."
Library Management System,Python,https://github.com/kunzbhatia/Library-Management-System,"The Library Management System is a Python-based application that integrates with a MySQL database to manage books, borrowers, and transactions. It allows functionalities such as adding/removing books, borrowing/returning books, calculating fines, and generating reports. The system also features user authentication, data validation, and a simple interface for efficient library management."
