title,category,reference,summary
Human Action Recognition,Data Science,https://github.com/nikhilkr31/human-action-recognition,"This project focuses on Human Action Recognition (HAR) using deep learning techniques, specifically leveraging VGG16 with transfer learning for video classification. The model identifies various human actions, such as walking, running, and talking, using preprocessed training data. Key techniques include categorical cross-entropy loss, Adam optimization, and model performance evaluation through accuracy and log loss, with recommendations for improving accuracy and preventing overfitting."
Medical Report Generation using CT Scans,Data Science,https://github.com/vysakh10/Medical-Report-Generation-using-Deep-Learning,"This project focuses on generating medical reports for chest X-rays using deep learning, specifically employing encoder-decoder architectures with attention mechanisms. The model processes X-ray images and generates descriptive medical reports that highlight key findings. It enhances the report generation process by improving accuracy and context understanding through the use of attention layers."
Email Classification,Data Science,https://github.com/SimarjotKaur/Email-Classifier,"This project focuses on email classification, categorizing emails into Normal, Spam, and Fraud using various machine learning classifiers like SVM, Nave Bayes, Decision Trees, and ensemble methods. It processes text data using TF-IDF and Count Vectorizers, evaluating model performance with metrics such as accuracy, precision, and recall. The best performing model was found to be an ensemble vote of SVM, Random Forest, and Bagging classifiers, trained on TF-IDF features without stemming."
Uber Data Analysis,Data Science,https://github.com/Unnati0104/Uber-Data-Analysis,"This project involves analyzing Uber pricing data using exploratory data analysis (EDA) and machine learning models to predict prices based on various features. After feature selection using recursive feature elimination, the models Decision Tree, Random Forest, and Gradient Boosting Regressor showed high accuracy, with Random Forest being chosen for its resistance to overfitting. The final model is used to predict Uber prices, aiding in better pricing analysis."
Sound Classification,Data Science,https://github.com/abishek-as/Audio-Classification-Deep-Learning,"This project involves audio classification using deep learning models (ANN, CNN1D, CNN2D) to categorize urban sounds into ten categories. It utilizes feature extraction with Mel-Frequency Cepstral Coefficients (MFCC) and compares model performance in terms of accuracy, training time, and prediction time. The models are deployed using Django, allowing users to record and classify real-time audio."
Credit Card Fraud Detection,Data Science,https://github.com/shakiliitju/Credit-Card-Fraud-Detection-Using-Machine-Learning,"This project focuses on detecting fraudulent credit card transactions using machine learning techniques, including K-Nearest Neighbors, Logistic Regression, Support Vector Machine, and Decision Tree. The dataset used consists of transaction data with features transformed using PCA, and the goal is to identify fraudulent transactions with high accuracy. The KNN and Decision Tree models performed best, achieving 100% accuracy, ensuring enhanced security and customer satisfaction."
Sign Language Recognition,Data Science,https://github.com/AvishakeAdhikary/Realtime-Sign-Language-Detection-Using-LSTM-Model,"The Realtime Sign Language Detection Using LSTM Model is a deep learning-based project that recognizes and interprets sign language gestures in real time using an LSTM neural network. It provides a user-friendly interface and supports multiple gestures, offering high accuracy for effective communication, especially for the deaf and hard of hearing community. The system is built with Python, TensorFlow, OpenCV, and Numpy, and is open-source for easy customization and integration."
Flower Class Prediction,Data Science,https://github.com/Apaulgithub/oibsip_taskno1,"The Iris Flower Classification project uses machine learning to classify iris flowers into three species: Setosa, Versicolor, and Virginica, based on their physical measurements. The project involves data exploration, preprocessing, and model training, with the tuned Random Forest model selected as the final classifier due to its high accuracy. The model can be applied in fields like botany and horticulture to automate species identification."
Color Detection,Data Science,https://github.com/manishsingh7163/Color-Detection,"The Color Detection project allows real-time identification of colors using a webcam or an image. It works by calculating the distance between the detected color and a predefined dataset of colors, finding the closest match. The system uses OpenCV and Python to detect and display the color names efficiently."
Loan Prediction,Data Science,https://github.com/Architectshwet/Loan-prediction-using-Machine-Learning-and-Python,"The Loan Prediction project uses machine learning techniques to predict whether a loan applicant can repay their loan based on various attributes like income, education, and property area. The project involves data analysis with pandas and visualization with seaborn, followed by model training using XGBoost and scikit-learn. It also incorporates hyperparameter tuning and voting ensemble methods to improve prediction accuracy."
Road Traffic Prediction,Data Science,https://github.com/atharva-hukkeri/Traffic-Prediction-using-Machine-Learning,"The Traffic Prediction project uses machine learning algorithms, specifically Random Forest and Support Vector Regression, to predict traffic congestion based on factors like day, temperature, and weather conditions. The dataset includes traffic levels coded on a five-level scale, with additional features like zone and temperature. The model achieved an accuracy of 86.58% with Random Forest and 87.84% with Support Vector Regression, showcasing effective traffic forecasting."
Income Classification,Data Science,https://github.com/semasuka/Income-classification,"The Income Classification project predicts whether an individual earns more or less than $50K per year based on various features such as education, relationship status, and capital gain. The final model used is a Random Forest classifier with a precision score of 87%. Deployed as a Streamlit app, it offers a tool for financial institutions to estimate income when applicant information is incomplete or confidential."
Speech Emotion Recognition,Data Science,https://github.com/MiteshPuthran/Speech-Emotion-Analyzer,"The Speech Emotion Analyzer project uses machine learning to detect emotions from speech, leveraging datasets like RAVDESS and SAVEE. By extracting audio features with the LibROSA library, a Convolutional Neural Network (CNN) model was built to classify emotions with over 70% accuracy. The model was tested with live voice recordings, successfully predicting emotions like anger, happiness, and sadness."
Celebrity Voice Prediction,Data Science,https://github.com/ptbailey/Speaker-Recognition,"The Speaker Recognition project identifies celebrities based on their voice using deep neural networks. By extracting audio features such as MFCC, Mel-spectrogram, and Tonnetz, a CNN model was trained, achieving a 0.73 F1-score. The model was tested on the VoxCeleb dataset, successfully recognizing celebrity voices and outperformed audience guesses in a live demo."
Store Sales Prediction,Data Science,https://github.com/asim5800/Retail-Sales-Prediction,"The Retail Sales Prediction project focuses on forecasting daily sales for Rossmann's 1,115 stores across Germany, using machine learning techniques. By performing feature engineering, exploratory data analysis, and hyperparameter tuning, the model achieved a 5.65% MAPE with high accuracy. The insights generated help optimize budget and inventory planning for future sales."
Detecting Parkinson's Disease,Data Science,https://github.com/guptaharshnavin/Parkinson-Disease-Detection,"The Parkinson's Disease Detection project uses machine learning to identify instances of Parkinson's Disease. After training multiple models, the Random Forest Classifier emerged as the best performer, achieving an accuracy of 99.61% and an F1 score of 0.96. The project includes data preprocessing, exploratory analysis, and model evaluation to optimize detection accuracy."
Air Pollution Prediction,Data Science,https://github.com/saniyaparveez/Air_pollution_prediction,"The Air Pollution Prediction project uses a Random Forest algorithm to predict real-time air quality levels in urban cities, focusing on particulate matter and AQI. By analyzing historical data from Bangalore, India, the system aims to offer accurate and cost-effective predictions for pollution control. The goal is to provide valuable air quality information for public awareness and management."
Age & Gender Detection,Data Science,https://github.com/smahesh29/Gender-and-Age-Detection,The Gender and Age Detection project uses deep learning techniques to predict a person's gender and age range from an image or webcam input. It leverages the Adience dataset for training and utilizes models for age and gender classification. The project supports real-time detection through images or webcam and provides accurate results in various conditions.
Optimizing Product Price,Data Science,https://github.com/sukesh-reddy/Retail-Price-Optimization-,The Retail Price Optimization project uses regression trees to develop a pricing algorithm aimed at optimizing retail prices. The model helps determine optimal prices based on various factors to maximize profits. This serves as a foundational step toward building a dynamic pricing system for retail businesses.
Breast Cancer Prediction,Data Science,https://github.com/Eakta08/Breast-Cancer-Prediction,"The Breast Cancer Prediction project uses machine learning and deep learning algorithms to predict whether a breast cancer tumor is malignant or benign. It utilizes the Breast Cancer Wisconsin dataset for training and testing models, comparing performance based on accuracy, F1 score, recall, and precision. The goal is to aid early diagnosis and support medical decision-making through accurate predictions."
Analyze COVID Vaccination Progress Using Python,Data Science,https://github.com/Ahad-Al-Seraihi/COVID-19-World-Vaccination-Progress,"This project explores COVID-19 vaccination progress worldwide from December 2020 to April 2021 using EDA techniques with Python libraries like Pandas, NumPy, and Matplotlib. It involved cleaning, wrangling, and visualizing data to answer key hypotheses regarding vaccination rates, country comparisons, and trends. The dataset includes information on total vaccinations, people vaccinated, daily vaccination rates, and vaccine distribution across various countries."
Financial Status Analysis For Credit Score Rating,Data Science,https://github.com/allanphil/Credit-Score-Classification,"This project aims to predict individuals' credit scores using machine learning models, with a focus on financial history and personal information. It involves exploratory data analysis, preprocessing, and training various models like Random Forest, with performance evaluated using metrics like accuracy, precision, and recall. The best model is then used to make predictions on new data, demonstrating practical skills in data science and machine learning."
Movie Based Recommendation,Data Science,https://github.com/rudrajikadra/Movie-Recommendation-System-Using-Python-and-Pandas,"This project builds a basic movie recommendation system using Python and the Pandas library, utilizing a subset of the MovieLens dataset. It calculates correlations between movies to recommend similar ones based on user input. The system provides the top 4 recommended movies based on a text input query."
Real-time Traffic Prediction,Data Science,https://github.com/ghimohammadr/Real-time-traffic-prediction,"This project involves real-time traffic prediction using time series forecasting, where the model is trained on historical data and updated using a rolling window technique. It evaluates the model's performance using metrics like Mean Squared Error (MSE). The script uses Python libraries such as Pandas, NumPy, and TensorFlow for training and forecasting."
Image Captioning,Data Science,https://github.com/IEEE-NITK/Image_Captioning,"This project focuses on image captioning using deep neural networks, incorporating Convolutional Neural Networks (CNN), Recurrent Neural Networks (RNN), and the Attention Mechanism. It uses Inception V3 for feature extraction and a simplified Gated Recurrent Unit (GRU) for sentence generation, achieving high BLEU scores. The model, trained on the Flickr8k dataset, demonstrates promising results in generating accurate and contextually relevant captions for images."
DSA Question Predicter,Data Science,https://github.com/dprasuna/Web-Based-Dsa-Tracker,The DSA Practice Tracker is a web-based platform designed to help individuals prepare for technical interviews by providing a curated set of Data Structures and Algorithms (DSA) questions from platforms like Geeks for Geeks and LeetCode. It offers categorized questions by difficulty levels and tracks users' progress. The app features a user-friendly interface with search functionality and progress tracking.
IoT Social Distancing & Monitoring for Queue,Internet of Things,https://github.com/sassoftware/iot-tracking-social-distancing-computer-vision,This project uses computer vision to track social distancing by detecting people in images and calculating real-world distances between them using a Tiny YOLO V2 model. It identifies crowds and visualizes the results while transforming image coordinates through homography matrices. The system integrates with SAS Event Stream Processing for real-time video analysis and crowd detection.
IoT Covid Patient Health Monitor in Quarantine,Internet of Things,https://github.com/CODERdotEXE/patient-health-monitoring-IOT,"This IoT-based patient health monitoring system uses an ESP32 board and sensors like MAX30100, DS18B20, and DHT11 to track vital health parameters such as heart rate, body temperature, and oxygen levels. Data is displayed in real-time via a web interface, allowing remote monitoring. The system aims to expand to medical institutions with advanced analytics, sensor integration, and enhanced security for holistic healthcare management."
IoT based Manhole Detection and Monitoring System,Internet of Things,https://github.com/Pooja123667/DSCWOW_Manhole-monitoring-system,"The DSCWOW Manhole Monitoring System is an IoT-based solution designed to monitor the health of manholes in real-time. It tracks parameters such as structural integrity, temperature, and humidity to ensure safety and prevent potential hazards. The system provides live updates and alerts for efficient management and maintenance."
IoT based Smart Energy Meter Monitoring with Theft Detection,Internet of Things,https://github.com/Abhirambs-08/IOT-Based-Smart-Energy-Meter-BEC,"The IoT-based Smart Energy Meter project uses an ESP32 board to monitor electricity consumption and prevent power theft. It collects real-time data from current and voltage sensors, which is then uploaded to the Blynk app for remote monitoring. The system enables efficient energy usage management and provides theft detection, making electricity consumption more controllable and secure."
IoT based Intelligent Gas Leakage Detector Using Arduino,Internet of Things,https://github.com/avimagar/Smart-Gas-Leak-Detector,"The Smart Gas Leakage Detector is an IoT-based system that detects LPG/CNG gas leaks and triggers an alarm. It sends an alert message to the owner and shows the location on Google Maps. The system uses an Arduino UNO, MQ6 gas sensor, and SIM900 GSM module for efficient detection and communication."
IoT based Smart Agriculture Monitoring System Project,Internet of Things,https://github.com/ankitsagar/Smart-Agriculture,"The IoT-based Smart Agriculture System monitors environmental factors like temperature, humidity, and soil moisture using sensors such as DHT11 and YL69. It automates irrigation by controlling a motor based on soil moisture levels via an ESP8266 Wi-Fi module and MQTT communication. Data visualization is done using ThingsBoard for real-time monitoring and analysis."
IoT based Automatic Vehicle Accident Detection and Rescue,Internet of Things,https://github.com/syedissambukhari/IoT-Based-Automatic-Accident-Detection-And-Rescue-system,"The IoT-Based Automatic Accident Detection and Rescue System uses sensors to detect vehicular accidents and automatically alerts emergency services with precise location details. It integrates an Arduino board, GPS module, GSM module, and accelerometer/gyroscope for real-time monitoring. The system ensures timely rescue response by notifying predefined contacts in case of an accident."
IoT based Coal Mine Safety Monitoring and Alerting System,Internet of Things,https://github.com/Alok2580/IoT-based-Smart-Coal-Mining-Safety-and-Alerting-System,"The IoT-based Smart Coal Mining Safety and Alerting System uses an ESP8266 module, DHT11, MQ2, and LDR sensors to monitor environmental conditions like temperature, humidity, light, and gas levels. The system integrates with the Blynk app for real-time data visualization and response actions, such as activating LEDs or buzzers. Potential expansions, like rain sensing, are also considered for future integration."
IoT based Heart Monitoring System Using ECG,Internet of Things,https://github.com/Ashithaby/IoT-based-low-cost-ECG-and-heart-monitoring-system-with-ESP32,"The IoT-based low-cost ECG and heart monitoring system uses an ESP32 and AD8232 sensor to provide continuous cardiac health monitoring. It offers real-time ECG data transmission to mobile apps via ThingSpeak, enabling remote patient monitoring and early detection of heart issues. The system is affordable, user-friendly, and aimed at improving healthcare accessibility, especially in resource-constrained settings."
IoT based  Weather Reporting,Internet of Things,https://github.com/Rashmika-B/IoT-based-Weather-Reporting-System,"The IoT-based Weather Reporting System utilizes a Raspberry Pi 4B+ along with sensors like DHT11, BMP180, and YL-83 to monitor weather parameters such as temperature, humidity, and pressure. It integrates with ThingSpeak for data collection and uses IFTTT to send alerts when rain is detected. The system enables advanced data analysis using MATLAB for improved weather forecasting and notifications."
IoT based  Weather Reporting,Internet of Things,https://github.com/Rashmika-B/IoT-based-Weather-Reporting-System,"The IoT-based Weather Reporting System uses a Raspberry Pi 4B+ with sensors like DHT11, BMP180, and YL-83 to monitor weather parameters such as temperature, humidity, and pressure. Data is collected via ThingSpeak Cloud, and alerts are triggered for rain detection using IFTTT. MATLAB is used for advanced data analysis to enhance forecasting and notifications."
IoT Early Flood Detection & Avoidance,Internet of Things,https://github.com/roycuadra/IoT-based-flood-detection-system,The IoT-based flood detection system uses an ESP8266 microcontroller and an ultrasonic sensor to monitor water levels in real-time. The system displays distance measurements on the Blynk app and triggers visual and audible alerts via LEDs and a buzzer based on predefined distance thresholds. This open-source project is designed for flood monitoring and early warning systems.
IoT Garbage Monitoring Using Raspberry Pi,Internet of Things,https://github.com/cloudwithtanvir/An-Android-Based-IoT-System-for-Garbage-Monitoring,"The IoT-based garbage collection system uses a Raspberry Pi 3 model B and ultrasonic sensors to monitor garbage levels in bins. The system leverages Python, Node.js, and Socket.io for data processing and communication. It enables smart garbage collection management, providing real-time updates to optimize waste collection routes."
IoT Circuit Breaker Project Women Safety Night Patrolling,Internet of Things,https://github.com/rakshixh/Samraksh,"""Samraksh"" is an IoT-based women safety device designed to provide real-time location tracking and alerts in distress situations. The system uses a GPS module, ESP8266, and a buzzer to notify trusted individuals when a woman is in danger. The device sends location data to the cloud, enabling quick response through Google Maps for emergency assistance."
IoT Robot,Internet of Things,https://github.com/vatsal2210/IoT-Robot,"The IoT-based robot can be controlled remotely via a website or mobile device using a Raspberry Pi, integrating sensors, camera streaming, and motor control. It functions as a personal assistant, offering real-time monitoring and data feedback through live streaming and sensor alerts. The project aims to enhance automation and security, with potential applications in home monitoring and robotics."
"IoT Energy Meter with Current, Voltage and Cost Monitoring System",Internet of Things,https://github.com/h3xb1n/IoT-Based-Smart-Energy-Meter,"The IoT-based Smart Energy Meter tracks live electricity usage via an Arduino Uno connected to a current sensor and ESP8266 Wi-Fi module. The data is sent to a Django web application, where users can view and download usage statistics in charts and Excel format. The system allows users to monitor daily and monthly power consumption along with bill calculations."
IoT Industry Protection System Arduino,Internet of Things,https://github.com/bharathrede/IOT-Industry-Protection-using-Arduino,"The IoT Industry Protection system uses Arduino to monitor industrial equipment for potential hazards. It integrates various sensors to detect issues such as gas leaks, temperature anomalies, and equipment malfunctions. Alerts are sent to the user via a connected network, ensuring timely responses to prevent accidents."
IoT Paralysis Patient Health Care Project,Internet of Things,https://github.com/20MH1A04H9/IOT_PROJECT,"The IoT-based automated healthcare monitoring system for paralysis patients uses sensors and actuators to track vital signs like heart rate and body temperature. It sends real-time data to a web interface, ensuring timely alerts for caregivers. The system aims to improve patient care by continuously monitoring and responding to health changes."
IoT Smart Mirror With News & Temperature,Internet of Things,https://github.com/aanandpant/IOT-based-smart-mirror,"The IoT-based smart mirror project displays useful information like news, weather, calendar, and time while also allowing voice control for appliances like lights and fans. It uses a Raspberry Pi 3, voice recognition, and a web portal for global appliance control. The mirror provides an interactive and modern way to manage daily tasks and home automation."
IoT Garbage Monitoring With Weight Sensing,Internet of Things,https://github.com/hegdepavankumar/smart-garbage-monitoring-system-using-iot,"The Smart Garbage Monitoring System helps automate the process of monitoring garbage bins in urban areas. Using IoT and various sensors, this system will inform waste collection teams when bins are full. This reduces human effort, improves waste management efficiency, and contributes to a cleaner environment."
IoT Asset tracking System,Internet of Things,https://github.com/redhat-iot/iot-assettracking-demo,"This project demonstrates an IoT solution for fleet telematics and asset tracking, using real-time data streaming from an IoT gateway device. It utilizes Eclipse Kapua for IoT cloud management, AngularJS for the frontend, and JBoss Data Grid for data handling. The solution provides a dashboard for monitoring critical package metrics like temperature, humidity, and displacement."
IoT Based ICU Patient Monitoring System Biometric Attendance System Over IOT,Internet of Things,https://github.com/YAGNESHPALLERLA/IoT-Based-ICU-Patient-Monitor-System,"The IoT-based ICU Patient Monitoring System continuously tracks critical health parameters such as blood pressure, heart rate, and body temperature using sensors connected to a Raspberry Pi. Data is transmitted in real-time to a web interface for remote monitoring by doctors, with an alert system for abnormal readings. The system is built with Python and Flask, and can be accessed globally for patient monitoring."
IoT Gas Pipe Leakage Detector Insect Robot,Internet of Things,https://github.com/Henil24G/FYP_VIT,"The Industrial IoT-Based Gas Pipe Leakage Detector Robot is designed to detect gas leaks (Methane, Butane, LPG, Smoke) in pipes by moving horizontally and vertically. It features a robotic system with DC motors and sensors, offering real-time data transmission to the cloud via IoT for remote monitoring. The robot also includes a GPS system to pinpoint the exact location of the leakage."
IoT Electronic Door Opener,Internet of Things,https://github.com/MicrochipTech/iot_solutions_for_smart_garage_door_opener,"The IoT Solutions for Smart Garage Door Opener allows users to control their garage doors using various wireless technologies such as Wi-Fi, BLE, and Zigbee. It integrates with voice assistants like Alexa and remote control via smartphone apps, leveraging cloud connectivity. The demo uses Microchip's WFI32 and WBZ451 modules for seamless wireless operation and real-time control."
