title,category,reference,summary
crypto Currency Price Info,HTML & CSS,https://github.com/surabhiojha12/Certificate_creation-,"This project generates event certificates using HTML, CSS, and jsPDF. It includes a details entry page, a certificate display page, and a PDF download option. The same logic can be applied to ticket booking systems."
Responsive Portfolio,HTML & CSS,https://github.com/bedimcode/portfolio-responsive-complete,"This project is a responsive personal portfolio website built with HTML, CSS, and JavaScript. It features smooth scrolling, animations, and a mobile-first design. The site is compatible with all devices and offers a visually appealing user interface."
Roadmap for Developers,HTML & CSS,https://github.com/kamranahmedse/developer-roadmap,"Roadmap.sh is a community-driven platform offering interactive roadmaps, best practices, and resources for developers across various domains like frontend, backend, DevOps, and AI. It provides structured learning paths, best practices, and knowledge-testing questions to help developers grow. The project is open-source, allowing contributions for adding, improving, and suggesting new roadmaps."
Photography Site,HTML & CSS,https://github.com/JoaoFranco03/photography-portfolio,"This project is a Photography Portfolio Website built using Tailwind CSS, HTML, CSS, and JavaScript to showcase photography work. It provides a responsive and customizable template that users can modify with their own images, bio, and contact details."
Technical Documentation Wiki,HTML & CSS,https://github.com/naemazam/Technical-Documentation-Page,"This project involves creating a Technical Documentation Page using HTML, CSS, and JavaScript. It focuses on structuring content effectively while practicing plain CSS for styling. The goal is to build a responsive, accessible, and well-organized documentation layout."
Survey Forms,HTML & CSS,https://github.com/lazy-geek/survey-form,"This project is a Survey Form created to practice CSS concepts. It includes custom checkboxes, CSS positioning techniques, and binding the checked event to labels for better usability."
Comic Reading Site,HTML & CSS,https://github.com/afzafri/Web-Comic-Reader/tree/master,"Web Comic Reader is a web-based CBR/CBZ/CBT comic book reader built with HTML5, JavaScript, and jQuery. It utilizes Uncompress.js for extraction and lightGallery for viewing comics."
Fashion eCommerce Website,HTML & CSS,https://github.com/wpcodevo/lc28-fashion-ecommerce-website,"Responsive Fashion E-commerce Website Template is built using HTML, CSS, and JavaScript. It provides a modern, mobile-friendly design for fashion stores."
Restaurant Management System,HTML & CSS,https://github.com/ankithcrgowda/Responsive-Restaurant-Website,"Restaurant Management System is a frontend project built with HTML5, CSS3, JavaScript, and Bootstrap. It provides a responsive and interactive user interface for managing restaurant operations. The design ensures a smooth user experience for customers and staff."
Event Management Website,HTML & CSS,https://github.com/roniy68/event-management,Event Management is a simple website template built with HTML and CSS to help users create event management platforms. It provides a structured layout for event organization and collaboration.
Product Landing Page,HTML & CSS,https://github.com/FreeCodeCamp-Solutions/Product-Landing-Page,"This project is a responsive product landing page built using HTML, CSS, and JavaScript, following FreeCodeCamp's requirements. It includes a fixed navigation bar, an embedded product video, and a subscription form with email validation. The page is styled using CSS flexbox and media queries to ensure responsiveness."
Travel Agency Landing Page,HTML & CSS,https://github.com/adityamamta/travel-one-page-website,"This project is a responsive travel agency landing page built with HTML, CSS, and JavaScript, featuring a modern and professional design. It includes sections for tour packages, services, testimonials, and a subscription form to enhance user engagement. The page is interactive, visually appealing, and optimized for all devices."
Tribute Page,HTML & CSS,https://github.com/kalawaja/freeCodeCamp_tributePage,"The Tribute Page project is a certification requirement where you create a tribute webpage for a real or fictional subject. It involves structuring the page with elements like a title, image, caption, tribute information, and a reference link while ensuring responsiveness and accessibility. The goal is to follow given user stories and styling guidelines to build a functional and visually appealing tribute page."
Parallax Site,HTML & CSS,https://github.com/VineetKumar02/Parallax-Website,"This project is a Parallax Scrolling Website that creates an interactive and immersive scrolling experience using HTML5, CSS3, and JavaScript. It features smooth animations, responsive design, and informative sections explaining parallax effects. Users can explore, modify, and contribute to enhance the project."
Weather Suggestions (Landing Page),HTML & CSS,https://github.com/Himanshu3412/Weather-Forecast,"The Weather Forecast project is a simple website built with HTML, CSS, and JavaScript that provides real-time weather updates. It allows users to search for specific locations and view details like temperature, humidity, wind speed, and weather conditions. The project fetches data from a weather API and dynamically updates the interface."
Event or Conference Page,HTML & CSS,https://github.com/harshi0102/ConferencePage,"The Conference Web Page - Capstone Project is a responsive website built using HTML, CSS, and JavaScript. It features semantic HTML, CSS Flexbox/Grid for layout, and JavaScript for dynamic interactions."
Online Store Page,HTML & CSS,https://github.com/lassiecoder/E-CommerceWebsite,"This project is a mobile-responsive e-commerce website built using HTML, CSS, JavaScript, and APIs. It includes a home page, a content description page for product details, an ordered list page for cart items, and an order confirmation page. The design focuses on user-friendly navigation and seamless shopping experience."
Restaurant (Landing Page),HTML & CSS,https://github.com/SrajanAgrawal/Restaurant-Landing-Page,"This project is a restaurant landing page designed using HTML and CSS. It features an attractive layout showcasing the restaurant's offerings, ambiance, and contact details. The design emphasizes responsiveness and visual appeal for an engaging user experience."
Quiz Game,HTML & CSS,https://github.com/jamesqquick/Build-A-Quiz-App-With-HTML-CSS-and-JavaScript,"This project is a Quiz App built using HTML, CSS, and JavaScript without external libraries or frameworks. It features dynamic question fetching from the Open Trivia DB API, local storage for high scores, a progress bar, and interactive feedback for answers. The project covers core web development concepts like ES6 features, Fetch API, CSS animations, and responsive design."
Podcast Website,HTML & CSS,https://github.com/codewithsadee/micro,"Micro is a fully responsive podcast website built using HTML, CSS, and JavaScript, designed to work seamlessly on all devices. It provides a clean and modern interface for showcasing podcasts with an engaging user experience."
Courses Website,HTML & CSS,https://github.com/keerti1924/E-Learning-Website-HTML-CSS,"Secret Coder is a responsive e-learning website built using HTML, CSS, Bootstrap 5, and JavaScript, offering interactive lessons and user authentication. It provides a structured course catalog, instructor application form, and contact options for an enhanced learning experience."
Food Delivery Tracking Website,HTML & CSS,https://github.com/shivamjain1/Online-food-ordering-app,"The Online Food Ordering App is a Swiggy/Zomato-like platform built using HTML, CSS, and pure JavaScript without any frameworks. It features restaurant search with debouncing, sorting by rating and ETA, and the ability to mark favorites."
Music Store Page,HTML & CSS,https://github.com/Zulhaditya/orbis-store,"Orbis Store is a minimalist music store website built using HTML, CSS, and JavaScript, featuring various musical instruments like guitars and drums. It includes a homepage, product list, product details, and a shopping cart for an enhanced shopping experience."
Simple Admission form,HTML & CSS,https://github.com/kumarsuraj345678/Student-Registration-Form,"The Student Registration Form is a modern, fully responsive web form with real-time validation, interactive UI, and Netlify Forms integration for seamless submission. It includes features like a password strength indicator, profile photo upload, and smooth animations for an intuitive user experience. Built using HTML5, CSS3, and JavaScript, it ensures a secure and efficient registration process."
CSS Image Gallery,HTML & CSS,https://github.com/Jonesdl-2785/image-gallery-html-css,"The Image Gallery is a simple, responsive web project built with HTML, CSS, and some JavaScript, featuring smooth hover effects and media queries. It includes a top navigation bar for easy section access and a scroll-to-top function using JavaScript. The gallery provides a visually appealing and interactive browsing experience."
Score Landing Page,HTML & CSS,https://github.com/mnassarhub/responsive-landing-page,"The Landing Page project transforms a static webpage into an interactive one using JavaScript, dynamically generating a navigation menu and active section highlighting. It includes smooth scrolling, a ""Go to Top"" button, and responsive design adjustments for different screen sizes. The project ensures usability across modern devices with accessibility and styling enhancements."
Info Page using apis,HTML & CSS,https://github.com/BoddepallyVenkatesh06/Build--Website-using-an-API-with-HTML-JavaScript-and-JSON,"The project is a website that uses an API with HTML, JavaScript, and JSON to display and manage blog content dynamically. It allows contributors to add resources by modifying a JSON file and making pull requests on GitHub. The project follows a structured development process with detailed contribution guidelines and a responsive design."
Virtual Classroom,HTML & CSS,https://github.com/nirmalnishant645/Virtual-Classroom,"The Virtual Classroom is a teaching tool designed to provide an interactive learning experience for students. It helps facilitate online education, especially during the pandemic, ensuring accessibility and engagement. The platform enhances remote learning through digital tools and interactive features."
ToDo App,JavaScript,https://github.com/CodeStudio-Content/To-Do-List-JavaScript,"The To-Do List project is a simple JavaScript-based web application for managing tasks. Users can add, edit, delete, and mark tasks as complete using an intuitive interface. It demonstrates DOM manipulation and event handling in a basic web application."
Tic Tac Toe Game,JavaScript,https://github.com/vasanthk/tic-tac-toe-js,"The Tic Tac Toe project is a simple web-based game built using HTML, JavaScript, and CSS. Players take turns marking spaces, with the game indicating whose turn it is and declaring a winner or a draw at the end. It requires no dependencies and provides a basic interactive experience."
JS Quiz App,JavaScript,https://github.com/yashcrest/JavaScript-Quiz-App,"The JavaScript Quiz App fetches trivia questions from the OpenTrivia API, allowing users to select categories and answer questions interactively. It features question navigation, correct answer indication, and a final score summary. Built with JavaScript, HTML, CSS, and Bootstrap, it provides an engaging quiz experience."
Expense Manager,JavaScript,https://github.com/Jdecho1118/Expense-Tracker,"The Expense Tracker Web App helps users manage their finances by tracking income and expenses in real time. It allows users to add, remove, and view transactions while dynamically updating balances. Built with HTML, CSS, and JavaScript, it ensures data persistence using local storage."
COVID CheckUp Test,JavaScript,https://github.com/pranjay-poddar/Covinex,"Covinex is a Covid-19 web app that provides self-assessment for testing, live global and country-level case tracking, and access to essential medical resources. Users can locate testing centers, pre-register for tests, and access updated information on hospital beds, oxygen suppliers, and plasma donors. Built with Angular, it also features an interactive chatbot for user queries."
Animation in Web Design,JavaScript,https://github.com/web-animations/web-animations-js,"Web Animations is a JavaScript API that unifies SVG and CSS animation capabilities, enabling high-performance animations on the web. This repository provides a polyfill for the Web Animations API, ensuring compatibility with browsers that lack native support. It includes documentation, examples, and a live demo to help developers implement animations easily."
Flappy Bird Game,JavaScript,https://github.com/aaarafat/JS-Flappy-Bird,JS-Flappy-Bird is a remake of the original Flappy Bird game using JavaScript and HTML Canvas. It features simple mechanics where players control a bird to navigate through obstacles. A playable demo is available online.
Snake Game,JavaScript,https://github.com/mohdriyaan/snake-game,"Snake-Game is a simple implementation of the classic Snake game using HTML, CSS, and JavaScript. Players control the snake with arrow keys to eat apples and grow while avoiding collisions. A playable version is available online."
Maze Game,JavaScript,https://github.com/husseinaltaaf/Maze-Game-JavaScript,"Labyrinthus is a maze game where players navigate from start to finish as quickly as possible using W, A, S, and D keys. It features five levels with increasing difficulty. The game is based on existing code, customized with additional features."
JavaScript Map,JavaScript,https://github.com/heremaps/maps-api-for-javascript-examples,"This project provides JavaScript-based examples using the HERE Maps API for JavaScript to showcase various mapping functionalities. It includes interactive demos for overlays, markers, routes, geolocation, clustering, and more."
Random Quotes Generator,JavaScript,https://github.com/RichardJamesWard/JS-Random-Quote-Generator,"This project is a JavaScript-based random quote generator that displays a new quote each time a button is clicked. It uses an array of objects to store quotes with properties like source, citation, and date. The project demonstrates fundamental JavaScript skills, including functions, loops, and object manipulation."
Light Switch Effect,JavaScript,https://github.com/romeojeremiah/javascript-light-switch-project,This project is a JavaScript-based light switch that toggles between light and dark modes when clicked. It uses event listeners to change the background color and update the UI dynamically. The project demonstrates basic JavaScript concepts like DOM manipulation and event handling.
Sudoku Solver,JavaScript,https://github.com/ayushichoudhary-19/SudokuSolver,"The Sudoku Solver is a web application that solves Sudoku puzzles using the Backtracking algorithm. Users can input a puzzle, click ""Solve,"" and get a valid solution displayed on the grid. Built with JavaScript, HTML, and CSS, it provides an interactive way to explore Sudoku-solving techniques."
Nano ID,JavaScript,https://github.com/ai/nanoid,"Nano ID is a tiny, secure, and URL-friendly unique string ID generator for JavaScript. It is lightweight (118 bytes), uses a hardware random generator for security, and generates shorter IDs than UUIDs while maintaining a low collision probability. Nano ID is available for multiple programming languages and can be used in various environments, including React, Node.js, and browsers."
Prettier,JavaScript,https://github.com/prettier/prettier,"Prettier is an opinionated code formatter that enforces a consistent style by parsing and reprinting code according to its rules. It supports multiple languages, including JavaScript, TypeScript, HTML, CSS, and more. It can be integrated into editors, pre-commit hooks, and CI environments to automate code formatting."
Space Invaders Game,JavaScript,https://github.com/yojoecool/SpaceInvaders,"This Space Invaders project is a browser-based remake of the classic arcade game, built using HTML5, CSS, and JavaScript with the Canvas API. Players navigate through three levels of increasing difficulty, dodging enemy bullets and preventing invaders from reaching the bottom. The game features responsive controls, smooth animations, and plans for future enhancements like more levels, bosses, and high scores."
Memory (Card game),JavaScript,https://github.com/taniarascia/memory,"This JavaScript Memory Game is a simple card-matching game inspired by Super Mario 3, built using plain JavaScript. Players flip cards to find matching pairs, with randomized card placement and interactive gameplay mechanics."
Drum Kit,JavaScript,https://github.com/git-vaibhav30/Drum-Kit,"The Drum Kit project is an interactive web app that lets users play virtual drums by clicking buttons or pressing keyboard keys. Built with HTML, CSS, and JavaScript, it features multiple drum sounds, keyboard shortcuts, and visual feedback. Users can experiment with different beats and rhythms for a fun musical experience."
The RGB Color Game,JavaScript,https://github.com/GovindCodes/ColorGame,"The RGB Color Game is a web-based color guessing game where players match colors to their RGB values. Built with JavaScript, HTML, and CSS, it offers two difficulty levels: easy and hard. Players guess the correct color until they find the right match."
Dice Game,JavaScript,https://github.com/Hashuudev/Dice-Game,"The Dice Game is a web-based two-player game where players roll a die to reach a total score of 100 points. Players can roll to accumulate points or ""hold"" to save their score, but rolling a 1 resets their turn. Built with HTML, CSS, and JavaScript, the game automatically switches turns and declares a winner at 100 points."
Music App,JavaScript,https://github.com/codewithsadee/music-player,"The Web Music Player is a fully responsive music player built using HTML, CSS, and JavaScript. It allows users to play music on any device with an intuitive interface."
Tip Calculator,JavaScript,https://github.com/nidhiupman568/TIP-CALCULATOR-HTML-CSS-JS-,"The Tip Calculator is a web-based tool built with HTML, CSS, and JavaScript to quickly compute tip amounts and total bills. It allows users to input the bill amount, select a tip percentage, and divide the total among multiple people. This project simplifies tipping calculations for restaurants and cafes."
Color Palette App,JavaScript,https://github.com/katecoded/color-palette-app,"The Color Palette Generator is a Flask-based web application that creates color palettes from themed nature photos. Users can select a theme or opt for a random selection, then choose an image to generate a palette from its colors."
Virtual Drums App,JavaScript,https://github.com/Alexoid1/Virtual-Drum,"Virtual-Drum is a web-based drum emulator that lets users play different drum sounds using their keyboard or mouse clicks. Built with HTML, CSS, and JavaScript, it adds visual effects for each key press. Users can try it online or download the code to run it locally."
Dice Roll,JavaScript,https://github.com/dice-roller/rpg-dice-roller,"RPG Dice Roller is a JavaScript-based tool for rolling various types of dice, applying modifiers, and performing mathematical calculations. It can be used in web applications, Vue components, CLI tools, and more. The project is open-source under the MIT license and supports community contributions."
Weather App,JavaScript,https://github.com/Prince-Shivaram/Simple-Weather-App,"This is a simple weather application built using HTML, CSS, and JavaScript. It helps beginners understand how to create a weather app by fetching real-time weather data."
Hangman Game,JavaScript,https://github.com/samruddhisomani/js-hangman,"JavaScript Hangman is a web-based game where users play hangman with an aquatic mammal theme. It was built using HTML, CSS, and JavaScript as part of the Vrbo 2019 Career Exploration Program. The project includes a live demo for users to try the game."
Transaction Limiter (Splitwise App Clone),JavaScript,https://github.com/PawanSirsat/SplitWise,"SplitWise Clone is a web application that helps users manage shared expenses, track group spending, and settle debts efficiently. It is built with React, Tailwind CSS, and Appwrite for database management."
Patatap Game,JavaScript,https://github.com/cdclaw/patatap-game,Patatap Game Clone is a fun web-based project that generates visual and sound effects when users press keys. It is built using Paper.js for graphics and Howler.js for audio.
URL Shortener,JavaScript,https://github.com/surishortlink/suri,"Suri is a static site generator for creating custom short links without the need for a server, database, or cloud functions. It uses a simple links.json file to manage redirects and can be deployed easily to platforms like Vercel, Netlify, and GitHub Pages. The project is lightweight, dependency-free, and optimized for easy updates and maintenance."
ID Card Generator,JavaScript,https://github.com/RahulBRB/ID-Card-Generator,"ID-Card-Generator is a web-based application that allows users to create customized ID cards by entering their details and profile image URL. The app features a sleek design with rounded corners, shadows, and a character-limited ""About Me"" section."
Movie Seat Booking App,JavaScript,https://github.com/nathanifill/movie-seat-booking,"The Movie Seat Booking project is a cinema-style seat booking system built with HTML, CSS, and JavaScript, using localStorage to retain seat selections across page refreshes. The app includes a movie screen that displays GIFs of the selected movie, which can be easily updated."
Whack-A-Mole Game,JavaScript,https://github.com/kubowania/whac-a-mole,"Whac-A-Mole is a simple grid-based game built with HTML, CSS, and JavaScript, where players hit the mole as many times as possible before time runs out. The project covers key JavaScript concepts like event listeners, intervals, and DOM manipulation."
Word Scramble,JavaScript,https://github.com/jeskodes/word-scramble,"Animal Scramble is a fun, quick word game where players unscramble animal-related words, designed for users of all ages. It features a simple interface, minimal instructions, and offers a lighthearted challenge. The project uses JavaScript, HTML, and CSS, with plans for future improvements like difficulty levels and enhanced accessibility."
Rock-Paper-Scissors Game,JavaScript,https://github.com/chauhan-hardik/Rock-Paper-Scissors,"The Rock, Paper, Scissors Game is a web-based interactive game built with HTML, CSS, and JavaScript, where players compete against the computer. It features a user-friendly interface, score tracking, and responsive design for seamless gameplay on all devices. The game allows players to choose their move and see the result, with engaging messages throughout the experience."
BMI Calculator,JavaScript,https://github.com/AbinandhMJ/BMI-Calculator,"The BMI Calculator is a web application built with HTML, CSS, Bootstrap 5, and JavaScript that allows users to calculate their BMI based on height and weight. It provides a color-coded result with categories like Underweight, Normal, Overweight, and Obese, along with a brief explanation. The responsive design ensures accessibility across devices, and users can easily input their data to receive the result instantly."
Random Joke AJAX Project,JavaScript,https://github.com/ryanbyrne28/project-1,"The ""Tell Me a Joke"" app is a simple jQuery and AJAX-based project that pulls random jokes from an API. Users can click a button to generate a new joke, with plans for future enhancements like keyword filtering and multi-part jokes. The app focuses on delivering fun, with minimal CSS and straightforward functionality."
Countdown Timer Project,JavaScript,https://github.com/sanjudhritlahre/JS-CountDown-Timer,"The JavaScript Countdown Timer is a web-based tool that allows users to set customizable countdowns for events, displaying the remaining time in a user-friendly format. It supports starting, pausing, and resetting the timer, with options for callback functions upon completion. The timer is also fully customizable through CSS and JavaScript."
Fruit Cutter Game,JavaScript,https://github.com/AchillesKarki/fruits-slice-game,"This is a fruit slicing game built with HTML, CSS, and JQuery, where fruits fall from above, and players use the mouse cursor to slice them. The game offers an engaging and interactive experience as fruits drop and can be sliced."
Seat Booking App,JavaScript,https://github.com/Rajnandanibais/seatbookingapp,"This seat booking app is built using JavaScript, allowing users to select and reserve seats in a virtual layout. It provides an interactive interface to manage seat availability and bookings. The app ensures a smooth and efficient seat selection process for users."
Chinese Checkers Game,JavaScript,https://github.com/fakegeek/Chinese-Checkers,"This project is an HTML5 and Canvas implementation of the Chinese Checkers game. It offers an interactive, web-based version of the classic board game, allowing players to engage in strategic moves. The game is designed with a visually appealing and functional interface using HTML5 and Canvas."
Time Table Maker,JavaScript,https://github.com/Sight-Innovation/Auto-TimeTable-Generator-for-Schools,This project provides an algorithm for an automated school timetable generator. It includes a JavaScript file with detailed comments to help users understand and implement the code. The tool is designed to simplify the creation of school timetables through automation.
